{
    "schema_version": "material_trajectory_execution_result.v1",
    "created_at": "2026-08-29T16:51:52.5103127Z",
    "trajectory_id": "mtc_061_mpb_mat_tiebijiangjun_keji1",
    "curriculum_id": "material_trajectory_curriculum_r002",
    "spec_path": "E:/Unity特效人工智能学习/workspace/data/vfx_generation/curricula/material_trajectory_curriculum_r002/specs/mtc_061_mpb_mat_tiebijiangjun_keji1.json",
    "category": "mpb",
    "label": "positive",
    "control_scope": "slot_mpb",
    "status": "pass",
    "prefab_path": "Assets/VFXSourceIngest/Trains/Trains_FX_All_001/ArtResources/FX/Battle/Fx_tiebijiangjun/eff/Fx_tiebijiangjun_hudun.prefab",
    "context_renderer_status": "prefab_material_match",
    "context_renderer_reason": "stable_quad_does_not_reproduce_source_particle_geometry",
    "effective_control_scope": "slot_mpb",
    "duration_seconds": 2.0,
    "sample_interval_seconds": 0.20000000298023225,
    "material_path": "Assets/VFXSourceIngest/Trains/Trains_FX_All_001/ArtResources/FX/Battle/Fx_tiebijiangjun/mat/Mat_tiebijiangjun_keji1.mat",
    "shader_name": "Common/ColorDefault",
    "material_timeline_path": "E:/Unity特效人工智能学习/workspace/data/vfx_generation/runs/material_trajectory_context_r030/candidates/mtc_061_mpb_mat_tiebijiangjun_keji1/material_timeline.json",
    "frames": [
        {
            "frame_index": 0,
            "requested_time_seconds": 0.0,
            "path": "frame_000_0_000.png",
            "valid": true,
            "file_size": 5627
        },
        {
            "frame_index": 1,
            "requested_time_seconds": 0.20000000298023225,
            "path": "frame_001_0_200.png",
            "valid": true,
            "file_size": 5627
        },
        {
            "frame_index": 2,
            "requested_time_seconds": 0.4000000059604645,
            "path": "frame_002_0_400.png",
            "valid": true,
            "file_size": 5627
        },
        {
            "frame_index": 3,
            "requested_time_seconds": 0.6000000238418579,
            "path": "frame_003_0_600.png",
            "valid": true,
            "file_size": 5627
        },
        {
            "frame_index": 4,
            "requested_time_seconds": 0.800000011920929,
            "path": "frame_004_0_800.png",
            "valid": true,
            "file_size": 5627
        },
        {
            "frame_index": 5,
            "requested_time_seconds": 1.0,
            "path": "frame_005_1_000.png",
            "valid": true,
            "file_size": 5627
        },
        {
            "frame_index": 6,
            "requested_time_seconds": 1.2000000476837159,
            "path": "frame_006_1_200.png",
            "valid": true,
            "file_size": 5627
        },
        {
            "frame_index": 7,
            "requested_time_seconds": 1.399999976158142,
            "path": "frame_007_1_400.png",
            "valid": true,
            "file_size": 5627
        },
        {
            "frame_index": 8,
            "requested_time_seconds": 1.600000023841858,
            "path": "frame_008_1_600.png",
            "valid": true,
            "file_size": 5627
        },
        {
            "frame_index": 9,
            "requested_time_seconds": 1.7999999523162842,
            "path": "frame_009_1_800.png",
            "valid": true,
            "file_size": 5627
        },
        {
            "frame_index": 10,
            "requested_time_seconds": 2.0,
            "path": "frame_010_2_000.png",
            "valid": true,
            "file_size": 5627
        }
    ],
    "valid_frame_count": 11,
    "expected_signals": [
        "slot_property_block_changed"
    ],
    "actual_signals": [
        "slot_property_block_changed"
    ],
    "raw_timeline_signals": [
        "slot_property_block_changed"
    ],
    "missing_signals": [],
    "unexpected_signals": [],
    "incidental_timeline_signals": [],
    "curves_executed": [
        "pulse"
    ],
    "parameter_track_count": 1,
    "keyword_event_count": 0,
    "texture_swap_event_count": 0,
    "material_replace_event_count": 0,
    "negative_mutation_executed": false,
    "invariant_errors": [],
    "resource_audit": {
        "runtime_materials_created": 1,
        "runtime_materials_destroyed": 1,
        "runtime_materials_live": 0,
        "runtime_textures_created": 11,
        "runtime_textures_destroyed": 11,
        "runtime_textures_live": 0,
        "destruction_mode": "UnityEngine.Object.Destroy completed before result write"
    },
    "error": ""
}
