{
    "schema_version": "material_trajectory_execution_result.v1",
    "created_at": "2026-08-29T15:15:08.8612537Z",
    "trajectory_id": "mtc_010_dissolve_mat_jianxian_15",
    "curriculum_id": "material_trajectory_curriculum_r002",
    "spec_path": "E:/Unity特效人工智能学习/workspace/data/vfx_generation/curricula/material_trajectory_curriculum_r002/specs/mtc_010_dissolve_mat_jianxian_15.json",
    "category": "dissolve",
    "label": "positive",
    "control_scope": "renderer_mpb",
    "status": "pass",
    "prefab_path": "Assets/VFXSourceIngest/Trains/Trains_FX_All_001/ArtResources/FX/juese/FX_SS_jianxan/eff/Fx_jianxian_glow.prefab",
    "context_renderer_status": "prefab_material_match",
    "context_renderer_reason": "stable_quad_does_not_reproduce_source_particle_geometry",
    "duration_seconds": 0.6000000238418579,
    "sample_interval_seconds": 0.06000000238418579,
    "material_path": "Assets/VFXSourceIngest/Trains/Trains_FX_All_001/ArtResources/FX/juese/FX_SS_jianxan/mat/Mat_jianxian_15.mat",
    "shader_name": "Common/ColorDefault",
    "material_timeline_path": "E:/Unity特效人工智能学习/workspace/data/vfx_generation/runs/material_trajectory_context_r001/candidates/mtc_010_dissolve_mat_jianxian_15/material_timeline.json",
    "frames": [
        {
            "frame_index": 0,
            "requested_time_seconds": 0.0,
            "path": "frame_000_0_000.png",
            "valid": true,
            "file_size": 6222
        },
        {
            "frame_index": 1,
            "requested_time_seconds": 0.05999999865889549,
            "path": "frame_001_0_060.png",
            "valid": true,
            "file_size": 16807
        },
        {
            "frame_index": 2,
            "requested_time_seconds": 0.11999999731779099,
            "path": "frame_002_0_120.png",
            "valid": true,
            "file_size": 16990
        },
        {
            "frame_index": 3,
            "requested_time_seconds": 0.18000000715255738,
            "path": "frame_003_0_180.png",
            "valid": true,
            "file_size": 16734
        },
        {
            "frame_index": 4,
            "requested_time_seconds": 0.23999999463558198,
            "path": "frame_004_0_240.png",
            "valid": true,
            "file_size": 16133
        },
        {
            "frame_index": 5,
            "requested_time_seconds": 0.30000001192092898,
            "path": "frame_005_0_300.png",
            "valid": true,
            "file_size": 13045
        },
        {
            "frame_index": 6,
            "requested_time_seconds": 0.36000001430511477,
            "path": "frame_006_0_360.png",
            "valid": true,
            "file_size": 8931
        },
        {
            "frame_index": 7,
            "requested_time_seconds": 0.41999998688697817,
            "path": "frame_007_0_420.png",
            "valid": true,
            "file_size": 5627
        },
        {
            "frame_index": 8,
            "requested_time_seconds": 0.47999998927116396,
            "path": "frame_008_0_480.png",
            "valid": true,
            "file_size": 5627
        },
        {
            "frame_index": 9,
            "requested_time_seconds": 0.5400000214576721,
            "path": "frame_009_0_540.png",
            "valid": true,
            "file_size": 5627
        },
        {
            "frame_index": 10,
            "requested_time_seconds": 0.6000000238418579,
            "path": "frame_010_0_600.png",
            "valid": true,
            "file_size": 5627
        }
    ],
    "valid_frame_count": 11,
    "expected_signals": [
        "dissolve_parameter_changed",
        "renderer_property_block_changed"
    ],
    "actual_signals": [
        "dissolve_parameter_changed",
        "renderer_property_block_changed"
    ],
    "raw_timeline_signals": [
        "dissolve_parameter_changed",
        "renderer_property_block_changed"
    ],
    "missing_signals": [],
    "unexpected_signals": [],
    "incidental_timeline_signals": [],
    "curves_executed": [
        "smoothstep"
    ],
    "parameter_track_count": 1,
    "keyword_event_count": 0,
    "texture_swap_event_count": 0,
    "material_replace_event_count": 0,
    "negative_mutation_executed": false,
    "invariant_errors": [],
    "resource_audit": {
        "runtime_materials_created": 1,
        "runtime_materials_destroyed": 1,
        "runtime_materials_live": 0,
        "runtime_textures_created": 11,
        "runtime_textures_destroyed": 11,
        "runtime_textures_live": 0,
        "destruction_mode": "UnityEngine.Object.Destroy completed before result write"
    },
    "error": ""
}
