{
    "schema_version": "material_trajectory_execution_result.v1",
    "created_at": "2026-08-29T15:55:57.5304925Z",
    "trajectory_id": "mtc_045_emission_alpha_mat_ui_propitem_glow_1",
    "curriculum_id": "material_trajectory_curriculum_r002",
    "spec_path": "E:/Unity特效人工智能学习/workspace/data/vfx_generation/curricula/material_trajectory_curriculum_r002/specs/mtc_045_emission_alpha_mat_ui_propitem_glow_1.json",
    "category": "emission_alpha",
    "label": "positive",
    "control_scope": "slot_mpb",
    "status": "pass",
    "prefab_path": "Assets/VFXSourceIngest/Trains/Trains_FX_All_001/ArtResources/FX/UI/Fx_ui_wupin_gs/FX_UI_PropItem.prefab",
    "context_renderer_status": "prefab_material_match",
    "context_renderer_reason": "stable_quad_does_not_reproduce_source_ui_geometry",
    "effective_control_scope": "material",
    "duration_seconds": 1.5,
    "sample_interval_seconds": 0.15000000596046449,
    "material_path": "Assets/VFXSourceIngest/Trains/Trains_FX_All_001/ArtResources/FX/UI/Fx_ui_wupin_gs/Mat/Mat_UI_PropItem_glow 1.mat",
    "shader_name": "UI/CustomUIDefault",
    "material_timeline_path": "E:/Unity特效人工智能学习/workspace/data/vfx_generation/runs/material_trajectory_context_r005/candidates/mtc_045_emission_alpha_mat_ui_propitem_glow_1/material_timeline.json",
    "frames": [
        {
            "frame_index": 0,
            "requested_time_seconds": 0.0,
            "path": "frame_000_0_000.png",
            "valid": true,
            "file_size": 5627
        },
        {
            "frame_index": 1,
            "requested_time_seconds": 0.15000000596046449,
            "path": "frame_001_0_150.png",
            "valid": true,
            "file_size": 5627
        },
        {
            "frame_index": 2,
            "requested_time_seconds": 0.30000001192092898,
            "path": "frame_002_0_300.png",
            "valid": true,
            "file_size": 5627
        },
        {
            "frame_index": 3,
            "requested_time_seconds": 0.44999998807907107,
            "path": "frame_003_0_450.png",
            "valid": true,
            "file_size": 5627
        },
        {
            "frame_index": 4,
            "requested_time_seconds": 0.6000000238418579,
            "path": "frame_004_0_600.png",
            "valid": true,
            "file_size": 5627
        },
        {
            "frame_index": 5,
            "requested_time_seconds": 0.75,
            "path": "frame_005_0_750.png",
            "valid": true,
            "file_size": 5627
        },
        {
            "frame_index": 6,
            "requested_time_seconds": 0.8999999761581421,
            "path": "frame_006_0_900.png",
            "valid": true,
            "file_size": 5627
        },
        {
            "frame_index": 7,
            "requested_time_seconds": 1.0499999523162842,
            "path": "frame_007_1_050.png",
            "valid": true,
            "file_size": 5627
        },
        {
            "frame_index": 8,
            "requested_time_seconds": 1.2000000476837159,
            "path": "frame_008_1_200.png",
            "valid": true,
            "file_size": 5627
        },
        {
            "frame_index": 9,
            "requested_time_seconds": 1.350000023841858,
            "path": "frame_009_1_350.png",
            "valid": true,
            "file_size": 5627
        },
        {
            "frame_index": 10,
            "requested_time_seconds": 1.5,
            "path": "frame_010_1_500.png",
            "valid": true,
            "file_size": 5627
        }
    ],
    "valid_frame_count": 11,
    "expected_signals": [
        "material_property_changed"
    ],
    "actual_signals": [
        "material_property_changed"
    ],
    "raw_timeline_signals": [
        "material_property_changed"
    ],
    "missing_signals": [],
    "unexpected_signals": [],
    "incidental_timeline_signals": [],
    "curves_executed": [
        "linear"
    ],
    "parameter_track_count": 1,
    "keyword_event_count": 0,
    "texture_swap_event_count": 0,
    "material_replace_event_count": 0,
    "negative_mutation_executed": false,
    "invariant_errors": [],
    "resource_audit": {
        "runtime_materials_created": 1,
        "runtime_materials_destroyed": 1,
        "runtime_materials_live": 0,
        "runtime_textures_created": 11,
        "runtime_textures_destroyed": 11,
        "runtime_textures_live": 0,
        "destruction_mode": "UnityEngine.Object.Destroy completed before result write"
    },
    "error": ""
}
