{
    "schema_version": "material_trajectory_execution_result.v1",
    "created_at": "2026-08-28T11:58:36.7621462Z",
    "trajectory_id": "mtc_063_mpb_suanyebowen4",
    "curriculum_id": "material_trajectory_curriculum_r002",
    "spec_path": "E:/Unity特效人工智能学习/workspace/data/vfx_generation/curricula/material_trajectory_curriculum_r002/specs/mtc_063_mpb_suanyebowen4.json",
    "category": "mpb",
    "label": "positive",
    "control_scope": "material",
    "status": "pass",
    "duration_seconds": 0.800000011920929,
    "sample_interval_seconds": 0.07999999821186066,
    "material_path": "Assets/VFXSourceIngest/Trains/Trains_IgnoreEffectPrefab_002/ArtResources/Effect/__Materials/suanyebowen4.mat",
    "shader_name": "Common/ColorDefault",
    "material_timeline_path": "E:/Unity特效人工智能学习/workspace/data/vfx_generation/runs/material_trajectory_r002_full_r001/candidates/mtc_063_mpb_suanyebowen4/material_timeline.json",
    "frames": [
        {
            "frame_index": 0,
            "requested_time_seconds": 0.0,
            "path": "frame_000_0_000.png",
            "valid": true,
            "file_size": 145061
        },
        {
            "frame_index": 1,
            "requested_time_seconds": 0.07999999821186066,
            "path": "frame_001_0_080.png",
            "valid": true,
            "file_size": 145061
        },
        {
            "frame_index": 2,
            "requested_time_seconds": 0.1599999964237213,
            "path": "frame_002_0_160.png",
            "valid": true,
            "file_size": 145061
        },
        {
            "frame_index": 3,
            "requested_time_seconds": 0.23999999463558198,
            "path": "frame_003_0_240.png",
            "valid": true,
            "file_size": 145061
        },
        {
            "frame_index": 4,
            "requested_time_seconds": 0.3199999928474426,
            "path": "frame_004_0_320.png",
            "valid": true,
            "file_size": 145061
        },
        {
            "frame_index": 5,
            "requested_time_seconds": 0.4000000059604645,
            "path": "frame_005_0_400.png",
            "valid": true,
            "file_size": 145061
        },
        {
            "frame_index": 6,
            "requested_time_seconds": 0.47999998927116396,
            "path": "frame_006_0_480.png",
            "valid": true,
            "file_size": 145061
        },
        {
            "frame_index": 7,
            "requested_time_seconds": 0.5600000023841858,
            "path": "frame_007_0_560.png",
            "valid": true,
            "file_size": 145061
        },
        {
            "frame_index": 8,
            "requested_time_seconds": 0.6399999856948853,
            "path": "frame_008_0_640.png",
            "valid": true,
            "file_size": 145061
        },
        {
            "frame_index": 9,
            "requested_time_seconds": 0.7200000286102295,
            "path": "frame_009_0_720.png",
            "valid": true,
            "file_size": 145061
        },
        {
            "frame_index": 10,
            "requested_time_seconds": 0.800000011920929,
            "path": "frame_010_0_800.png",
            "valid": true,
            "file_size": 145061
        }
    ],
    "valid_frame_count": 11,
    "expected_signals": [
        "material_property_changed"
    ],
    "actual_signals": [
        "material_property_changed"
    ],
    "raw_timeline_signals": [
        "material_property_changed"
    ],
    "missing_signals": [],
    "unexpected_signals": [],
    "incidental_timeline_signals": [],
    "curves_executed": [
        "smoothstep"
    ],
    "parameter_track_count": 1,
    "keyword_event_count": 0,
    "texture_swap_event_count": 0,
    "material_replace_event_count": 0,
    "negative_mutation_executed": false,
    "invariant_errors": [],
    "resource_audit": {
        "runtime_materials_created": 1,
        "runtime_materials_destroyed": 1,
        "runtime_materials_live": 0,
        "runtime_textures_created": 11,
        "runtime_textures_destroyed": 11,
        "runtime_textures_live": 0,
        "destruction_mode": "UnityEngine.Object.Destroy completed before result write"
    },
    "error": ""
}
