{
    "schema_version": "material_trajectory_execution_result.v1",
    "created_at": "2026-08-28T11:58:31.2792729Z",
    "trajectory_id": "mtc_030_flow_distortion_mat_27_glow_02",
    "curriculum_id": "material_trajectory_curriculum_r002",
    "spec_path": "E:/Unity特效人工智能学习/workspace/data/vfx_generation/curricula/material_trajectory_curriculum_r002/specs/mtc_030_flow_distortion_mat_27_glow_02.json",
    "category": "flow_distortion",
    "label": "positive",
    "control_scope": "renderer_mpb",
    "status": "pass",
    "duration_seconds": 1.0,
    "sample_interval_seconds": 0.10000000149011612,
    "material_path": "Assets/VFXSourceIngest/Trains/Trains_IgnoreEffectPrefab_002/ArtResources/Effect/__Materials/Mat_27_Glow_02.mat",
    "shader_name": "Common/ColorDefault",
    "material_timeline_path": "E:/Unity特效人工智能学习/workspace/data/vfx_generation/runs/material_trajectory_r002_full_r001/candidates/mtc_030_flow_distortion_mat_27_glow_02/material_timeline.json",
    "frames": [
        {
            "frame_index": 0,
            "requested_time_seconds": 0.0,
            "path": "frame_000_0_000.png",
            "valid": true,
            "file_size": 5627
        },
        {
            "frame_index": 1,
            "requested_time_seconds": 0.10000000149011612,
            "path": "frame_001_0_100.png",
            "valid": true,
            "file_size": 5627
        },
        {
            "frame_index": 2,
            "requested_time_seconds": 0.20000000298023225,
            "path": "frame_002_0_200.png",
            "valid": true,
            "file_size": 5627
        },
        {
            "frame_index": 3,
            "requested_time_seconds": 0.30000001192092898,
            "path": "frame_003_0_300.png",
            "valid": true,
            "file_size": 5627
        },
        {
            "frame_index": 4,
            "requested_time_seconds": 0.4000000059604645,
            "path": "frame_004_0_400.png",
            "valid": true,
            "file_size": 5627
        },
        {
            "frame_index": 5,
            "requested_time_seconds": 0.5,
            "path": "frame_005_0_500.png",
            "valid": true,
            "file_size": 5627
        },
        {
            "frame_index": 6,
            "requested_time_seconds": 0.6000000238418579,
            "path": "frame_006_0_600.png",
            "valid": true,
            "file_size": 5627
        },
        {
            "frame_index": 7,
            "requested_time_seconds": 0.699999988079071,
            "path": "frame_007_0_700.png",
            "valid": true,
            "file_size": 5627
        },
        {
            "frame_index": 8,
            "requested_time_seconds": 0.800000011920929,
            "path": "frame_008_0_800.png",
            "valid": true,
            "file_size": 5627
        },
        {
            "frame_index": 9,
            "requested_time_seconds": 0.8999999761581421,
            "path": "frame_009_0_900.png",
            "valid": true,
            "file_size": 5627
        },
        {
            "frame_index": 10,
            "requested_time_seconds": 1.0,
            "path": "frame_010_1_000.png",
            "valid": true,
            "file_size": 5627
        }
    ],
    "valid_frame_count": 11,
    "expected_signals": [
        "renderer_property_block_changed"
    ],
    "actual_signals": [
        "renderer_property_block_changed"
    ],
    "raw_timeline_signals": [
        "renderer_property_block_changed"
    ],
    "missing_signals": [],
    "unexpected_signals": [],
    "incidental_timeline_signals": [],
    "curves_executed": [
        "pulse"
    ],
    "parameter_track_count": 1,
    "keyword_event_count": 0,
    "texture_swap_event_count": 0,
    "material_replace_event_count": 0,
    "negative_mutation_executed": false,
    "invariant_errors": [],
    "resource_audit": {
        "runtime_materials_created": 1,
        "runtime_materials_destroyed": 1,
        "runtime_materials_live": 0,
        "runtime_textures_created": 11,
        "runtime_textures_destroyed": 11,
        "runtime_textures_live": 0,
        "destruction_mode": "UnityEngine.Object.Destroy completed before result write"
    },
    "error": ""
}
